{
  "schema_version": 1,
  "id": "unicode-edge-xlsx-001",
  "title": "Unicode edge cells xlsx 001",
  "source": "generated",
  "generator": {
    "name": "harness/generator",
    "version": "0.1.0"
  },
  "format": "xlsx",
  "categories": [
    "unicode-edge"
  ],
  "features": {
    "w:tbl": 0,
    "w:drawing": 0,
    "w:fldSimple": 0,
    "w:commentReference": 0,
    "w:comment": 0,
    "w:instrText": 0
  },
  "reference_text": "corpus/reference/unicode-edge-xlsx-001.txt",
  "expected": {
    "page_count_min": null,
    "page_count_max": null
  },
  "render": {
    "dpis": [
      150
    ],
    "engines": [
      "soffice-26.2.5"
    ]
  },
  "notes": "six real shared-string/inline cell values: typographic ligatures ﬁﬂ (compatibility codepoints, no font trickery), one ZWJ-joined family emoji (U+1F468/469/467/466 with U+200D separators), a decomposed e+U+0301 combining sequence, NBSP (U+00A0) inside a Latin sentence, CJK '床前明月光' (Quiet Night Thought line 1, per-char F1 rule applies downstream), and a Hebrew+Latin mixed run — one per cell A1..A6, no escaping or normalization applied by the generator.",
  "sha256": "8fe0a535921cbd2a3b034ac83d3cebf484b3f3a4addc5be271ae708d0a85e0c9"
}
