{
  "schema_version": 1,
  "id": "huge-cell-text-docx-001",
  "title": "Huge cell text docx 001",
  "source": "generated",
  "generator": {
    "name": "harness/generator",
    "version": "0.1.0"
  },
  "format": "docx",
  "categories": [
    "huge-cell-text"
  ],
  "features": {
    "w:tbl": 1,
    "w:drawing": 0,
    "w:fldSimple": 0,
    "w:commentReference": 0,
    "w:comment": 0,
    "w:instrText": 0
  },
  "reference_text": "corpus/reference/huge-cell-text-docx-001.txt",
  "expected": {
    "page_count_min": null,
    "page_count_max": null
  },
  "render": {
    "dpis": [
      150
    ],
    "engines": [
      "soffice-26.2.5"
    ]
  },
  "notes": "real huge single-string text (not an image or overflow hack): one paragraph holding the deterministic 60,000-char string 'lorem ipsum ' * 5000 in a single w:t run, plus a 3x2 Table Grid table whose cell(1,1) holds 'lorem ipsum ' * 834 (10,008 chars); other cells are short r{r}c{c} markers. Reference text is the exact same strings, byte-for-byte as inserted. Deflate compresses the repetitive lorem hard: saved blob is 36857 bytes, far under the 10 MB cap. Overflow/wrap/pagination behavior at render time is the fixture's point.",
  "sha256": "3540f1d1623e0298a1b4e50464199ad4b4e9a5cfd5d2cc2f4d5a3d353a852b90"
}
