{
  "schema_version": 1,
  "id": "embedded-ole-docx-001",
  "title": "Embedded OLE object docx 001",
  "source": "generated",
  "generator": {
    "name": "harness/generator",
    "version": "0.1.0"
  },
  "format": "docx",
  "categories": [
    "embedded-ole"
  ],
  "features": {
    "w:tbl": 0,
    "w:drawing": 0,
    "w:fldSimple": 0,
    "w:commentReference": 0,
    "w:comment": 0,
    "w:instrText": 0
  },
  "reference_text": "corpus/reference/embedded-ole-docx-001.txt",
  "expected": {
    "page_count_min": null,
    "page_count_max": null
  },
  "render": {
    "dpis": [
      150
    ],
    "engines": [
      "soffice-26.2.5"
    ]
  },
  "notes": "real package-level embedding plumbing, stub payload: word/embeddings/object1.bin added (the bin part is a 1x1 PNG byte stub declared with the oleObject relationship type and oleObject content type — the type/content mismatch is intentional: an honest stub, no CFB structure inside); body carries a legacy w:pict with v:shape o:ole=rId9 plus an o:OLEObject child (Type=Embed, DrawAspect=Icon) — no w:drawing used, so the w:drawing metric stays 0; document.xml.rels oleObject relationship + Content_Types oleObject override added via zip_read/zip_write. LibreOffice may show an icon or render nothing for the stub; the embed carries no text truth, so reference_text covers only the body text.",
  "sha256": "b1ec838e07ce54d44f2c3e98f859b180eba282cc706c158d2381e4bdc12bdf63"
}
