{
  "schema_version": 1,
  "id": "pdf-annot-highlight-pdf-001",
  "title": "Highlight annotation on page 1",
  "source": "generated",
  "generator": {
    "name": "harness/generator",
    "version": "0.1.0"
  },
  "format": "pdf",
  "categories": [
    "pdf-annot-highlight"
  ],
  "features": {
    "pdf:pages": 1,
    "pdf:annotations": 1,
    "pdf:annot-types": 1,
    "pdf:sig-fields": 0
  },
  "reference_text": "corpus/reference/pdf-annot-highlight-pdf-001.txt",
  "expected": {
    "page_count_min": 1,
    "page_count_max": 1
  },
  "render": {
    "dpis": [
      150
    ],
    "engines": [
      "soffice-26.2.5"
    ]
  },
  "notes": "Single highlight annotation with QuadPoints on page 1; yellow color [1,1,0].",
  "sha256": "70a9bcaefe3ce7f717566a7e425726555c06fba00c19e4efa0e1f44c2c373953"
}
