{
  "schema_version": 1,
  "id": "pdf-annot-highlight-pdf-002",
  "title": "Multiple highlight annotations on one page",
  "source": "generated",
  "generator": {
    "name": "harness/generator",
    "version": "0.1.0"
  },
  "format": "pdf",
  "categories": [
    "pdf-annot-highlight"
  ],
  "features": {
    "pdf:pages": 1,
    "pdf:annotations": 2,
    "pdf:annot-types": 1,
    "pdf:sig-fields": 0
  },
  "reference_text": "corpus/reference/pdf-annot-highlight-pdf-002.txt",
  "expected": {
    "page_count_min": 1,
    "page_count_max": 1
  },
  "render": {
    "dpis": [
      150
    ],
    "engines": [
      "soffice-26.2.5"
    ]
  },
  "notes": "Two highlight annotations on page 1 at different positions.",
  "sha256": "f608eaae9ecad46c00d7b3b942c1dc2b28c48163a591d490e175bb4ba1d267b5"
}
