{
  "schema_version": 1,
  "id": "rtl-text-pptx-002",
  "title": "RTL text pptx 002",
  "source": "generated",
  "generator": {
    "name": "harness/generator",
    "version": "0.1.0"
  },
  "format": "pptx",
  "categories": [
    "rtl-text"
  ],
  "features": {
    "w:tbl": 0,
    "w:drawing": 0,
    "w:fldSimple": 0,
    "w:commentReference": 0,
    "w:comment": 0,
    "w:instrText": 0
  },
  "reference_text": "corpus/reference/rtl-text-pptx-002.txt",
  "expected": {
    "page_count_min": null,
    "page_count_max": null
  },
  "render": {
    "dpis": [
      150
    ],
    "engines": [
      "soffice-26.2.5"
    ]
  },
  "notes": "second instance, same flag machinery (a:pPr algn=\"r\" + rtl=\"1\" on all five paragraphs, one a:rPr rtl=\"0\" island), different STRINGS: the Arabic paragraph is the folk opening «كان الزمان زمان» (the alphabet demo of 001 is asserted absent), the three buChar Hebrew bullets take lines 2-4 of the shared pool (001 takes 1-3), and the mixed note paragraph embeds the Latin island «HAR-02 gate» between Hebrew runs (001's «stichos» is asserted absent). cs hints unchanged (Naskh for Arabic, Noto Sans Hebrew ×5). reference_text is the exact inserted strings in logical order.",
  "sha256": "6b54c2c188536313337269b0ad68833e7b06cd0e9467d73c3ce3f10df46f74fc"
}
