{
  "schema_version": 1,
  "id": "scanned-ocr-pptx-001",
  "title": "Scanned slide pptx 001",
  "source": "generated",
  "generator": {
    "name": "harness/generator",
    "version": "0.1.0"
  },
  "format": "pptx",
  "categories": [
    "scanned-ocr"
  ],
  "features": {
    "w:tbl": 0,
    "w:drawing": 0,
    "w:fldSimple": 0,
    "w:commentReference": 0,
    "w:comment": 0,
    "w:instrText": 0
  },
  "reference_text": "corpus/reference/scanned-ocr-pptx-001.txt",
  "expected": {
    "page_count_min": null,
    "page_count_max": null
  },
  "render": {
    "dpis": [
      150
    ],
    "engines": [
      "soffice-26.2.5"
    ]
  },
  "notes": "scanned-slide emulation on the docx scanned-ocr pattern: the same synthetic raster generator (_sc_scan_png imported from the docx builder — off-white paper gray, gray pseudo-text word bars, seeded per-pixel noise from the fixture-seeded ctx.rng) is embedded via add_picture stretched to the FULL slide (slide_width x slide_height), with one caption text box near the bottom. The raster has NO text layer (bars, not glyphs), so there is no OCR truth inside the picture: reference_text is the caption ONLY — the honest near-None case.",
  "sha256": "f3966a9a60ef912492de3b31d9187fdea621f42a30c9e589af62889cb69cb97f"
}
