{
  "schema_version": 1,
  "id": "toc-fields-docx-002",
  "title": "TOC field docx 002",
  "source": "generated",
  "generator": {
    "name": "harness/generator",
    "version": "0.1.0"
  },
  "format": "docx",
  "categories": [
    "toc-fields"
  ],
  "features": {
    "w:tbl": 0,
    "w:drawing": 0,
    "w:fldSimple": 1,
    "w:commentReference": 0,
    "w:comment": 0,
    "w:instrText": 0
  },
  "reference_text": "corpus/reference/toc-fields-docx-002.txt",
  "expected": {
    "page_count_min": null,
    "page_count_max": null
  },
  "render": {
    "dpis": [
      150
    ],
    "engines": [
      "soffice-26.2.5"
    ]
  },
  "notes": "real w:fldSimple TOC field (instr \" TOC \\o \"1-3\" \\h \\z \\u \") injected via raw python-docx oxml parse_xml; placeholder run only — no cached field results and no w:fldChar/instrText begin-separate-end sequence (python-docx does not evaluate fields).",
  "sha256": "bcc899d05d7619b3719ddf35737f27bd4705b5e474fb7a01cc29226391705677"
}
