{
  "schema_version": 1,
  "id": "protected-readonly-ods-001",
  "title": "Protected readonly ods 001",
  "source": "generated",
  "generator": {
    "name": "harness/generator",
    "version": "0.1.0"
  },
  "format": "ods",
  "categories": [
    "protected-readonly"
  ],
  "features": {
    "table:table": 1,
    "draw:frame": 0,
    "text:note": 0,
    "text:field": 0,
    "office:annotation": 0
  },
  "reference_text": "corpus/reference/protected-readonly-ods-001.txt",
  "expected": {
    "page_count_min": null,
    "page_count_max": null
  },
  "render": {
    "dpis": [
      150
    ],
    "engines": [
      "soffice-26.2.5"
    ]
  },
  "notes": "real ODF sheet protection at cell granularity: the table:table (table:name Locked) carries table:protected=\"true\" and one cell opts back in to editing with table:protect=\"false\" (ODF 1.2 §9.4: table:protect toggles protection of a single cell inside a protected table). No table:protection-key digest or digest-algorithm attribute is emitted — the fixture is password-less by design. Honest caveats: ODF sheet protection is advisory and renderer-policy — LibreOffice will open the sheet flagged protected but, without a protection-key, unprotecting needs no password; whether a render engine honors table:protected at all, and its tolerance of a boolean-only protected flag without key attributes, is UNVERIFIED (LibreOffice is not run in this environment). Reference text is the four cell strings; the normative counter reads table:table=1.",
  "sha256": "3d3e1799ae7971e38fc7a1625c70ba266ad495815796f96ae5f2be9661eb4f9d"
}
