{
  "schema_version": 1,
  "id": "headers-fields-odt-001",
  "title": "Headers and fields odt 001",
  "source": "generated",
  "generator": {
    "name": "harness/generator",
    "version": "0.1.0"
  },
  "format": "odt",
  "categories": [
    "headers-fields"
  ],
  "features": {
    "table:table": 0,
    "draw:frame": 0,
    "text:note": 0,
    "text:field": 0,
    "office:annotation": 0
  },
  "reference_text": "corpus/reference/headers-fields-odt-001.txt",
  "expected": {
    "page_count_min": null,
    "page_count_max": null
  },
  "render": {
    "dpis": [
      150
    ],
    "engines": [
      "soffice-26.2.5"
    ]
  },
  "notes": "real ODF master-page header/footer in styles.xml (style:master-page \"Standard\", A4 page-layout pm1): header carries two text:field elements (text:field-name page-number / page-count, integer value-type, cached display \"1 / 1\"). Honest caveats: (a) the normative text:field counter scans content.xml only, so these styles.xml field elements count 0 in the manifest; (b) the page fields are generic text:field user-field elements carrying cached display text, not dedicated text:page-number/text:page-count — LibreOffice shows the cached values; (c) header/footer strings are excluded from the reference text because renderers re-evaluate/re-position header content per page.",
  "sha256": "ace2f73febea95055a6cf9083af301532d475d8b5a9cd00ac2f17864c528f876"
}
