{
  "schema_version": 1,
  "id": "pdf-signed-pdf-001",
  "title": "Self-signed PDF (simple)",
  "source": "generated",
  "generator": {
    "name": "p5-02-pdf-fixtures",
    "version": "0.1.0"
  },
  "format": "pdf",
  "categories": [
    "pdf-signed"
  ],
  "features": {
    "pdf:pages": 1,
    "pdf:annotations": 0,
    "pdf:annot-types": 0,
    "pdf:sig-fields": 0
  },
  "reference_text": "corpus/reference/pdf-signed-pdf-001.txt",
  "expected": {
    "page_count_min": 1,
    "page_count_max": 1
  },
  "render": {
    "dpis": [
      150
    ],
    "engines": [
      "soffice-26.2.5"
    ]
  },
  "notes": "Self-signed PDF with PKCS#7 detached signature. Tests signature detection + PAdES-B-B path.",
  "sha256": "3f87bd8aadac999ceb565c056737d3890f9b8c4844eba69fba7d088ea48b4cfe"
}
