{
  "schema_version": 1,
  "id": "unicode-edge-pptx-002",
  "title": "Unicode edge pptx 002",
  "source": "generated",
  "generator": {
    "name": "harness/generator",
    "version": "0.1.0"
  },
  "format": "pptx",
  "categories": [
    "unicode-edge"
  ],
  "features": {
    "w:tbl": 0,
    "w:drawing": 0,
    "w:fldSimple": 0,
    "w:commentReference": 0,
    "w:comment": 0,
    "w:instrText": 0
  },
  "reference_text": "corpus/reference/unicode-edge-pptx-002.txt",
  "expected": {
    "page_count_min": null,
    "page_count_max": null
  },
  "render": {
    "dpis": [
      150
    ],
    "engines": [
      "soffice-26.2.5"
    ]
  },
  "notes": "second instance exercises a DIFFERENT edge family than 001 (001 = BMP ligatures/ZWJ/combining/NBSP/soft-hyphen, shared with docx-001): here the docx-002 family constants — mathematical double-struck letters U+1D54F/U+1D550 (astral plane), mathematical bold digits U+1D7CF..D7D1 (non-ASCII numerals that break naive isdigit), U+2764 with VS15 U+FE0E vs VS16 U+FE0F side by side, an LRM U+200E/RLM U+200F bidi sandwich wrapping Hebrew, and a paragraph whose FIRST character is U+FEFF — spread as six paragraphs in one text frame, byte-exact in a:t runs. Tofu/substitution under LibreOffice remains a REAL fidelity finding.",
  "sha256": "5eba554b8bc82cc56b8c930592f57304ba27b85d8e78d27e26a2de8845fc2ee9"
}
