{
  "schema_version": 1,
  "id": "pdf-annot-stamp-pdf-001",
  "title": "Stamp annotation (Approved) on page 1",
  "source": "generated",
  "generator": {
    "name": "p5-02-pdf-fixtures",
    "version": "0.1.0"
  },
  "format": "pdf",
  "categories": [
    "pdf-annot-stamp"
  ],
  "features": {
    "pdf:pages": 1,
    "pdf:annotations": 1,
    "pdf:annot-types": 1,
    "pdf:sig-fields": 0
  },
  "reference_text": "corpus/reference/pdf-annot-stamp-pdf-001.txt",
  "expected": {
    "page_count_min": 1,
    "page_count_max": 1
  },
  "render": {
    "dpis": [
      150
    ],
    "engines": [
      "soffice-26.2.5"
    ]
  },
  "notes": "Single Stamp annotation with Name=/Approved and Contents.",
  "sha256": "9872e0bd91066c7b1d926030403451a7ce17adc777665f2bb91bd69f2df03f8f"
}
